id,start,end,page_content,speaker,duration,video_id
1,0.16,36.199997,"Otuz Ocak bin dokuz yüz otuz üç günü, Alman tarihinin ilk anayasal cumhuriyet dönemi olan Weimar Cumhuriyeti'nin başına, bu cumhuriyetin adını da koyacak olan on beşinci şansölyesi atandı. Adolf Hitler ve Hitler'in demokrasi tarihinin gördüğü en baş döndürücü politik dönüşümlerinden birini gerçekleştirerek, Alman demokrasi deneyimini yerle bir etmeyi başarması, sadece bir ay, üç hafta, iki gün, sekiz saat ve kırk dakika sürdü. Evet, o sondaki kırk dakikanın bile çok büyük bir önemi var. Göreceksiniz.",0,32.0199983,b4z2WdDozU0
2,36.579998,73.65501,"Gelin bugün biraz daha sıra dışı bir konuyu masaya yatıralım ve her geçen gün biraz daha unuttuğumuz tarihten neler öğrenebileceğimizi hep birlikte görelim. Hitler durup dururken Alman devletinin başkanı seçilmedi. Bin dokuz yüz otuz üç yılındaki atamasına gelene kadar Hitler, sağcı rakiplerini ya ehlileştirmiş ya da tamamen elimine etmiş, çok zeki, çok kurnaz ve çok deneyimli bir politikacıydı. Son derece etkili bir muhalefet yaparak, yasal süreçleri yıllar yılı paralize edebilecek politikaları nasıl uygulayabileceğini",0,32.060014,b4z2WdDozU0
3,74.515,114.515,"birinci elden öğrenmişti. Hatta kendi atamasından önceki sekiz ayda bu öğrendiklerini sert bir şekilde uygulayarak tam üç şansölyeyi koltuğundan etmeyi başarmış, Cumhurbaşkanı'na Reichstag'ı yani Alman Federal Parlamentosu'nu iki kez lağvetmeye zorlayarak ülkeyi tekrar tekrar seçimlere sürüklemişti. Bu kaos, onun yükselişinin temellerini atacaktı ama Hitler gücü bir kez eline geçirdiğinde, başkalarına yaptıklarının kendi başına gelmeyeceğinden emin olmak için, demokrasiyi ortadan kaldırması gerektiğini çok iyi biliyordu. Hatta bu nedenle, şansölye olarak atanmasından",0,32.264988,b4z2WdDozU0
4,114.975006,149.65,"yıllar önce, bin dokuz yüz yirmi üç yılının Kasım ayında, emrindeki Nazilerle birlikte, derhal Puç olarak bilinen vahşi bir darbe girişimiyle Weimar Cumhuriyeti'ni düşürmeyi denemiş ama başarısız olmuştu. On beş Lazi'nin, dört polis memurunun ve bir sivilin ölümüyle sonuçlanan bu kalkışma, Hitler'i Alman politik sahnesine iten olayların başlangıcı olmuştu. Hitler, olaydan iki iki gün sonra tutuklanmış ve devlete ihanet suçuyla yargılanmıştı. Yirmi dört gün süren mahkeme boyunca Hitler ve söyledikleri",0,31.534989,b4z2WdDozU0
5,150.27,185.72499,"gazetelerde boy boy manşet edilmiş, bu sayede ideolojisini birinci elden halka ulaştırma fırsatı bulmuştu. Hitler, bu olaylar silsilesi sonucunda, Lansberg Cezaevi'nde beş yıl hapse mahkum edildi ve burada meşhur bir şekilde Mine Kamuf, yani Kavgam kitabını yazdı. Daha doğrusu iki diğer mahkuma kitabı dikte ettirdi. Hapiste dokuz ay yattıktan sonra da serbest bırakıldı ama işte bu başarısız darbe girişimi, Hitler'in güce zorbalıkla erişemeyeceğini anlamasını sağlamıştı. Hitler o noktada",0,30.13995,b4z2WdDozU0
6,186.265,225.685,"adeta bir legalitatside, yani bir yasallık yemini etmişti. Demokrasiyi, demokratik ve yasal yollarla yıkmaya ant içmişti. Mesela İkinci Dünya Savaşı sonrasında kurulan NURENberg Mahkemelerinde Hitler'i anlatan özel avukatı Hans Frank, Hitler'in her türlü yasal sistemde bulunan sisteme içkin potansiyel zayıflıkları sezmek konusunda olağanüstü bir yeteneği olduğunu söylemişti. Yani Hitler başarısız darbe girişimi sonrasında, kendisinin aslen güçlü olan taraflarını, demokrasinin bilinen zaaflarıyla birleştirerek düşmanını alt etmeye karar vermişti. Sonraki yillardaki",0,32.04003,b4z2WdDozU0
7,225.985,267.795,"Nazi propagandasını da tamamen bu ideal çerçevesinde şekillendirdi. Planının mantığı, özünde çok temel bir rasyonale dayanıyordu. Demokratik Almanya'nın kalbinde yer alan Weimar Cumhuriyeti Anayasası'nın birinci maddesinde devlet, halkın iradesinin bir ifadesi olarak tanımlanmıştı. Dolayısıyla Hitler'e göre gücü tamamen yasal yollarla eline geçirebilirse devleti de istediği gibi şekillendirebilmeliydi. Çünkü en nihayetinde demokratik anayasa, ona halkın iradesini tecelli Hitler başa gelebildiğine göre, halk da onun ideallerini kayıtsız şartsız destekliyor demekti. Öyle değil mi? Pek",0,30.01502,b4z2WdDozU0
8,269.23502,306.055,"pek sayılmaz ve aslında Hitler de bunun farkındaydı. Sonuçta demokrasi, sadece devlet başkanının iki dudağı arasında değildi. En azından şimdilik. Ortada, demokrasinin beşiği olan federal bir meclis vardı Bu meclisteki koltuk sayısı, bir liderin neyi yapıp neyi yapamayacağını direkt olarak belirliyordu. Evet Nazi Partisi, özellikle de bin dokuz yüz yirmi dokuz Ekonomik Buhranı sonrasında, Reichstag'daki temsiliyetini, on iki delegeden yüz yedi delegeye kadar çıkarmayı başarmıştı ki bu sayı Temmuz bin dokuz yüz otuz iki seçimlerinde",0,30.11999,b4z2WdDozU0
9,306.595,339.305,"iki yüz otuz koltuğa kadar çıkacaktı ama bu sayı bile meclisteki toplam koltuk sayısının sadece yüzde otuz yedisine karşılık geliyordu. Hitler'in rakip olarak gördüğü ama aynı zamanda ideolojik ve demokratik nedenlerle mecburen işbirliği yaptığı sağ kanadın toplam koltuk sayısı bile, taş çatlasa yüzde elli bire anca ulaşıyordu. Halbuki Hitler'in anayasayı yasal yollarla değiştirebilmek ve güçler ayrılığını ortadan kaldırarak bütün yetkiyi kendi elinde toplayabilmesi",0,31.17,b4z2WdDozU0
10,339.605,377.36,"için, Reichstag'ın en az yüzde altmış yedisine hükmetmesi ama Hitler'in kafa yapısını şuradan anlayın. Amerikalı bir gazeteciye verdiği bir demeçte söylediklerine bakılırsa, Hitler'e göre Nasyonal Sosyalist Parti'nin son yillardaki kazanımları kendisine mutlak gücü çoktan vermişti. Mesela o az önce bahsettiğim yüzde otuz yedilik koltuk oranının, yüzde elli birin yüzde yetmiş beşine, yani ezici çoğunluğa karşılık geldiğini söylüyordu. Yani Hitler'in gözünde basit çoğunluğun göreli çoğunluğuna sahip olmak, mutlak yetkiye sahip olmak için yeterliydi.",0,32.265,b4z2WdDozU0
11,377.74,414.59003,"Bu arada Hitler'in tabii ki bir politikacı olarak bir dolu vaadi vardı. Bir numaralı ajandası, Birinci Dünya Savaşı'nda feci bir şekilde bozguna uğratılmış, sonrasındaysa ekonomik bir çöküntüye girmiş Almanya'yı ayağa kaldırmaktı. Halktan istediği tek şey dört yıl çıktı. Bu dört yıllık iktidarı sırasında ekonomiyi canlandıracak, Almanların baş belası olan işsizliği azaltacak, askeri harcamaları arttıracak, Almanya'nın elini kolunu bağlayan uluslararası anlaşmalardan çekilecek, ulusun kanını zehirlediğine inandığı yabancıları ülkesinden atacak,",0,30.15503,b4z2WdDozU0
12,414.97,452.945,"politik rakiplerinden öcünü alacaktı. Hitler öylesine nefret doluydu ki, başa geldiğinde olacakları tarif etmek için, Türkçe'de kelleler omuzlarından ayrılacak anlamına gelen bir deyim olan Dan Wirden Die Coke ve rollen, yani Kafalar Kumda dönecek demişti. Ama tüm bunları başarabilmek için bir Ermachtigunz Gesetze, yani güç verici bir yasaya ihtiyacı olduğunu düşünüyordu. Heyhat, o yüzde altmış yedi barajı, Hitler'in güç matematiğini alt üst ediyordu. Richstag'ın beş yüz seksen dört koltuğunun iki yüz yirmi biri, yani kabaca yüzde otuz sekizi sosyal",0,32.91499,b4z2WdDozU0
13,453.405,487.495,"demokratların ve komünistlerin elindeydi ve Hitler, her ne kadar partisinin adında sosyalizm sözcüğüne yer vererek işçilere göz kırpmış olsa da, politik ve reel ideoloji bakımından taban tabana zıt olduğu bu partileri tatlı yolla dize getiremeyeceğini biliyordu. O nedenle hedefe giden tek yolun komünizmi yasaklamak ve bu yolla Komünist Parti'den kurtulmak olduğu sonucuna vardı. Bunu yaparsa, ihtiyaç duyduğu meclis çoğunluğuna demokratik bir şekilde ulaşabilirdi. Sorun şu ki, bunu yapacak olursa Almanya'daki",0,31.7300400000001,b4z2WdDozU0
14,487.96,523.91003,"altı milyon komünist ayaklanabilir ve greve giderek zaten pamuk ipliğine bağlı olan Alman ekonomisine diz çöktürebilirdi. Bir diğer opsiyon, güçlü retoriğine güvenip seçimleri yenileyerek sandıktan daha da güçlü çıkmayı ummaktı. Ama kabinesinde koalisyon yoluyla Ekonomi Bakanı olan Alman Nasyonalist Partisi'nden Alfred Hougenberg buna ayak deliyordu. Çünkü altı Kasım bin dokuz yüz otuz iki seçimlerinde partisi Hitler'in nasyonal sosyalist Alman İşçi Partisi'nden, yani kısaca Nazi Partisi'nden on dört koltuk çalmayı başarmıştı",0,30.3097900000001,b4z2WdDozU0
15,524.29004,563.77496,"ve bunu hemen kaybetmek istemiyordu. Hitler orduyu kullanarak Komünist Parti'yi ortadan kaldırma ihtimali üzerinde de durdu ama Savunma Bakanı Wernher von Blonberg Alman ordusunun Alman halkına silah kaldıramayacağını söyleyerek, Hitler'in bu düşüncesini savuşturdu. İşte bence demokrasinin tam da bu tarafı hoş. Hitler gücü elinde toplayacak her yolu arıyor ama demokratik güvenlik mekanizmaları onu her seferinde durdurmayı başarıyor. Yani o noktaya kadar demokrasi kendisinden beklenen görevi yerine getiriyordu. Ama Hitler de sonuçta boş bir politikacı değildi. Elindeki tüm opsiyonları tartarak",0,35.7599199999999,b4z2WdDozU0
16,564.075,598.90497,kimi karşısına almasının en doğru olacağını değerlendirdi ve sonuç olarak yeni bir seçim ilan etmeye karar verdi. Bakın ben buraya kadar bunları etraflıca anlattım ama bu ilan Hitler'in şansölye olarak atanmasından sadece bir gün sonra oluyor. Yani Hitler otuz Ocak bin dokuz yüz otuz üçte şansölye olarak atandı. Ertesi gün otuz bir Ocak bin dokuz yüz otuz üçte Meclisi lağvederek beş Mart bin dokuz yüz otuz üçte yeni bir seçim olacağını ilan etti ve Hitler'in bu seçimde vatandaşlarına verdiği bir tanecik söz,0,32.135,b4z2WdDozU0
17,599.285,634.66,"vardı. Bataklığı kurutmak. Ona göre meclisi dolduran politikacıların hepsi kariyer politikacısıydı ve halkın ihtiyaçlarına kulak vermiyorlardı. Yani meclis bir bataklık gibiydi. Bundan kurtulmanın tek yolu, bataklığı tamamen kurutmaktı ve işe kendi partisine savaş açarak başladı. Halka seslendiği bir konuşmasında, şu anda var olan hükumetin adının nasyonal sosyalist olduğunu, değerlerininse nasyonal sosyalist olmadığını ilan etti. Yine de önündeki yol çok çetindi. Birazcık geri alalım. Aralık bin dokuz yüz otuz ikiye gelindiğinde,",0,30.5899300000002,b4z2WdDozU0
18,635.12,672.785,"Hitler'in partisi hem maddi olarak, hem politik olarak, hem de ideolojik olarak çökmüş haldeydi. Hatta dedim ya, Kasım bin dokuz yüz otuz ikideki seçimlerde Hitler otuz dört koltuk birden kaybetmişti. Etrafındakilerin söylediğine göre Hitler, o noktada intiharı bile düşünüyordu. İşler o derece kötüydü. Bu vaziyetten sadece iki ay sonra, devletin başına getirileceği bir olaylar silsilesinin tetiklenmesi, işte biraz da bu nedenle ona mucizevi geliyordu. Tarihteki birçok diğer büyük isim gibi, Hitler'in de bir seçilmişlik takıntısı vardı ve bu olaylar",0,34.28507,b4z2WdDozU0
19,673.085,711.005,"onun gözünde seçilmişliğinin bir ispatı gibiydi. Kim bilir, belki de o nedenle Naziler de kendilerinden önceki Alman orduları gibi kemer tokalarında kocaman harflerle Gottmit Uns yani Tanrı Bizimledir sloganını taşıdılar. Ama işte Tanrı Hitler'in yanında olsun veya olmasın, o yıkık noktadan sonraki bir iki ayda kapalı kapılar ardında yapılan görüşmeler biraz şansla, şansla biraz da politik dehayla birleşince Almanya'nın anahtarını Hitler'e verecekti. Hitler'in büyük bir diğer derdi de kendisini",0,30.70498,b4z2WdDozU0
20,711.38495,751.245,"sürekli dizginlemeye çalışan Cumhurbaşkanı Paul von Hindenburg ve eski Şansölye, şimdi ise Hitler'e Şansölye yardımcısı olarak atanan Franz von Papendi. Yani demokrasi, Hitler'in yükselişini öyle açık bir kucakla falan karşılamıyordu. Mesela o kapalı kapılar ardında dönen pazarlıklar sonucunda Hitler, Şansölye olarak atanmasına rağmen kabinesine sadece iki tane bakan atayabilecekti. Geri kalanları diğer isimlerce seçilecekti. Bunlardan biri İçişleri Bakanlığı'ydı. Diğeri de spesifik bir bakanlık bile verilmeyen açık bir pozisyondu. Ama Hitler, elde ne varsa onu kullanarak",0,32.8200200000001,b4z2WdDozU0
21,751.645,787.755,"hedefine ulaşması gerektiğini çok iyi biliyordu. Dolayısıyla İçişleri Bakanlığına Wilhelm Friggy atadı. Sonradan Alman topraklarının üçte ikisini oluşturan Prusya eyaletinin İçişleri Bakanlığına dönüşecek olan o açık pozisyonaysa Hermann görünge atadı. Her ikisine de kendisinin Weimar Cumhuriyeti lakabını taktığı Alman demokrasisinin her ne değeri varsa ona saldırma görevini verdi. Özellikle de ifade özgürlüğü, yargı süreçleri, referandum hakkı ve eyaletlerin hakları gibi konulara ve ikili, patronlarının planını tıkır tıkır",0,31.3899399999998,b4z2WdDozU0
22,788.135,824.48,"işletmeye başladı. İçişleri Bakanı olan Frigg'in elinde medyanın ve Berlin'in gücü vardı. Bu güçleri kullanarak, eyaletlerin haklarını bir bir ellerinden almaya ve başta Komünist Kızıl Bayrak gazetesi ile Sosyal Demokrat İleri gazetesi olmak üzere, sol tandanslı bütün tandanslı bütün gazeteleri yasaklamaya başladı ve kalan gazetelerin gücünü kullanarak Nazi propagandasını daha fazla sayıda Alman'a ulaştırmaya başladı. Göring ise, ordu hariç Almanya'nın en büyük kolluk gücü olan Prusya Eyalet Polisi'ni ele Prusya Eyalet Polisi'ni ele geçirdi. Bütün polis müdürlerini Nazi ideolojisiyle",0,32.34504,b4z2WdDozU0
23,825.01996,861.67,"örtüşen kişilerle değiştirdi ve sonrasında da Hills Politzei yani Vekil Polis adını verdiği, kahverengi paltolar üzerine o meşhur beyaz pazı bantlarını takan polisleri göreve getirdi. Sonrasında da, emrindeki bütün polislere bir sheesserlas yani vur emri verdi. Görünge göre, eğer ki kendi polisleri, birilerini cezalandırdığı için ceza yemekten korkarsa, kızıl çete dediği komünistlerle mücadele edemezlerdi. Bu nedenle insanları özgürce vurma yetkisine sahip olmalılardı. Göring onlara şöyle dedi.",0,31.4550500000001,b4z2WdDozU0
24,876.03,911.7,"Bu arada o dönemde de bu hızlı politik değişimi anlamlandırma çabası bir dolu komplo teorisini beraberinde getirmişti. Herkes, Hitler'in gücü böylesine hızlı bir şekilde ele geçirişini anlamlandırmaya çalışıyordu. Kimine göre göre Hitler sadece bir kukladan ibaretti. Hitler'in iplerini elinde tutan, Hindenberg'in görevden son aldığı şansölyü olan Kurt von Schlenscher'di. Kimine göreyse Hitler, Alman aristokratlarının oyuncağı olmuş, zavallı bir Avusturyalıdan ibaretti. Bazılarıysa Hitler'in Otto Wolf gibi endüstrici kodamanlar tarafından",0,33.6550099999999,b4z2WdDozU0
25,912.08,952.845,"yönlendirildiğine, asıl amacının onların karlarını katlamak olduğuna inanıyordu. Hatta Cumhurbaşkanı Hindenberg'in aslında gizliden gizliye bir monarşist olduğunu ve Hitler aracılığıyla monarşiyi geri getirmeye çalıştığını söyleyenler bile vardı. Geriye dönüp baktığımızda, bunların çok ufak tefek doğruluk payları olmakla birlikte, aslında ne kadar acınası analizler veya tahminler olduğunu görmek zor değil. Ama işte bunları anlamak da, hem bazı şeylerin nasıl değişmediğini görmek hem de o dönemi doğru kavramak açısından çok önemli. Sonuçta o günlerde de hiç kimse Hitler'in işleri nereye götüreceğini bilemiyordu ve daha önemlisi",0,37.9848899999998,b4z2WdDozU0
26,953.225,991.76,"bu tür iddialar, halk arasına kuşku tohumları ekerek Hitler'in partisi üzerinde gerçek bir baskı oluşturuyordu. Sonuçta Hitler tek başına bir hiçti. Var olabilmek ve gayelerine ulaşabilmek için halkın desteğini yanına almak zorunda olduğunun çok iyi farkındaydı. O nedenle mesela gazeteler, Hitler'i ve politikalarını bırakın üçüncü imparatorluğu, Thirdrike'ı, buna iki buçuk imparatorluk bile denemez tarzı eleştirilerle hedef aldığında, Hitler'in zaten o noktada zayıf olan gücü daha da aşınıyordu. Mesela on sekiz Şubat bin dokuz yüz otuz üçte sol merkez tandanslı Wossyches Zeitung,",0,34.99,b4z2WdDozU0
27,992.22,1045.29,"Hitler'in tamamen boş laftan ibaret olduğunu, politikalarının ortalama almanın hayatını hiçbir şekilde iyileştirmediğini, hatta işleri daha da kötüleştirdiğini yazdı. İddialarına örnek olarak, Hitler'in dış ülkelerden gelen tahıl ürünleri üzerindeki gümrük vergisini iki katına çıkarmasını gösterdi. Evet sözde böyle bir politika vardı imparatorluğun, o ayın muğlak'tı ve tabii bir de Hindenberg tehlikesi vardı. Cumhurbaşkanı, son sekiz ayda üç şansölyeyi değiştirmişti. Haliyle Hitler'i de her an görevden alabilirdi. Hindenberg zaten Hitler'den",0,31.08487,b4z2WdDozU0
28,1045.5901,1087.2949,"hiç hazzetmiyordu. Bu bilinen bir gerçekti. Mesela bin dokuz yüz otuz iki Ağustos'unda Hitler'in asla bir şansölye atanmayacağını açık bir şekilde söylemişti. Kendisini yakından tanıyanlaraysa, Hitler'in devlette alabileceği tek pozisyonun postacıbaşı olabileceğini, bu sayede posta pullarını yaladığı gibi kendi kıçını yalayabileceğini söylüyordu. Hatta Hitler'i Nazi Partisi'nin son seçimlerindeki göreli başarısından, mecburiyetten ve biraz da alternatifsizlikten ötürü şans öyle atamak zorunda kaldığında, asla kendisiyle bir odada yalnız kalmama şartını koşmuştu. Hitler'e o derece güvenmiyordu. Yani Hitler için şansölyelik,",0,32.999800000001,b4z2WdDozU0
29,1087.755,1122.655,"öyle güllük gülistanlık bir pozisyon değildi. Eğer ki hemen bir mucize olmazsa, vadesinin dolmak üzere olduğunu çok iyi görüyordu. Tabii ki mucize beklemeyle gelmez. Hitler o mucizeyi kendisi yarattı veya yaratılmış bir mucizeye harika bir şekilde kondu. Yirmi yedi Şubat bin dokuz yüz otuz üçte, yani Hitler'in başa geçmesinden dört hafta sonra, ilan ettiği yeni seçimlerdense sadece bir hafta önce, Alman parlamento binası birdenbire alevler içinde kaldı. Bu, bir kundaklama vakasıydı. Bina",0,30.0949000000001,b4z2WdDozU0
30,1123.18,1159.2401,"neredeyse tamamen yanıp kül oldu. Alevler öylesine büyüktü ki, altmış beş kilometre uzaktaki kasabalardan bile görülebiliyordu. Parlamento binasıyla birlikte Alman demokrasisinin de yanıp kül olduğu imgesi, Almanya'da Almanya'da adeta bir deprem etkisi yarattı. Bu, Hitler'in işaret fişeğiydi. Anında harekete geçti. Yangını çıkaranların komünistler olduğunu, bu yangının komünist bir darbenin başlangıcı olduğunu iddia etti. Bakan yaptığı Göring de hemen komünistlerin diğer kamu binalarını yakmaya, halkın su kaynaklarını zehirlemeye ve devlet yetkililerinin",0,30.9801000000002,b4z2WdDozU0
31,1159.62,1196.0449,"karılarını ve çocuklarını kaçırmaya yönelik planları olduğunu keşfettiklerini ilan ederek, ortaya açtı. İçişleri Bakanı Freaks'se yangını ve bu iddiayı bahane ederek, bütün sivil hakları askıya alan, polise arama ve el koyma konusunda sınırsız yetki veren, eyaletlerin haklarını ortadan kaldıran bir yasa tasarısı hazırladı ve golü attı. Demokrasiyse alın size demokrasi. Değil mi? Tabii ki komünistler de yangının suçlusunun Naziler olduğunu söylediler ama o dönemde komünizm Avrupa'da öylesine büyük bir korku sebebine dönüşmüştü ki halkın ortak kanaati",0,33.9449000000004,b4z2WdDozU0
32,1196.345,1236.355,"bu belirsiz dönemde sırtlarını ulusalcılara dayayıp komünistlerin karşısında yer almaktı. Komünizmin Almanya için büyük bir tehdit olduğunu düşünen Cumhurbaşkanı Hindenberg de halkla birlikte komünistlerin karşısında yer almayı seçti. O nedenle Frigg'in hazırladığı o korkunç tasarıyı imzalayarak yasalaştırdı. Bu, domino taşlarından sonuncusunun düşmesi demekti. Hitler için kapılar bir anda sonuna kadar açılmıştı. Hitler'in şahmata giden yolda artık yapması gereken tek bir hamle kalmıştı. Mart seçimlerinden sadece bir hafta önce devreye giren bu olağanüstü hali gerekçe göstererek,",0,33.7249000000004,b4z2WdDozU0
33,1236.735,1275.49,"Komünist partileri tamamen yasakladı. Binlerce Komünist ve sosyal demokrat evlerinden toplandı. Nazi karşıtı medya çalışanlarının hepsi bir bir tutuklandı. Almanya, beş Mart bin dokuz yüz otuz üçte işte bu şartlar altında sandığa gitti. Ne ironiktir ki, Weimar Cumhuriyeti'nin son çok partili seçimlerinde kırk milyon Alman, yani seçmenlerin yüzde seksen dokuzu oy kullandı. Bu, bin sekiz yüz yetmiş birden o yana olan tüm seçimler arasında iki milyon seçmen farkla en çok katılımlı seçim demekti ve bu ekstra oyların neredeyse tamamı",0,33.4548000000002,b4z2WdDozU0
34,1276.35,1310.655,"Hitler'in Nazi partisine gitti. Kritik rakiplerin birçoğu da elimine edildiği için, Hitler o seçimlerde yüzde kırk dört oy almayı başardı. Bu söz verdiği yüzde elli biri alamaması demekti. Hatta sosyal demokratlar o seçimlerde teknik olarak sadece bir koltuk kaybetmişlerdi. Ama işte Komünist Parti'nin yüzde on üç oy almasına rağmen parlamentoda yer almasının yasaklanmış olması ve Hitler'in sağcılarla koalisyon kuracağı düşünüldüğünde, bu oy oranı müthiş bir başarıya işaret ediyordu. Hitler, ilk olarak Cumhurbaşkanı",0,31.7651000000001,b4z2WdDozU0
35,1311.515,1349.305,"tehdidinin ortadan kaldırılması gerektiğini biliyordu. Çünkü iktidarı halen onun iki dudağının arasındaydı. Onu yanına çekebilmek için Prusya geleneğine derin bir saygı gösterdiğini sinyalleyen bir şekilde, Thirdric yani Üçüncü İmparatorluğu ilanı için Potsdam'daki Garrison Kilisesini seçti. Hitler ve Hindenberg, yirmi bir Mart bin dokuz yüz otuz üç günü burada halk karşısına bir arada çıktılar. Hindenberg, askeri üniforması içindeydi. Hitler ise daha sivil bir üniforma seçmişti. Bu gelecekte agresif olmayacağı mesajını veriyordu ve Hitler şaşırtıcı bir şekilde Hindenberg'in",0,32.7198999999998,b4z2WdDozU0
36,1349.925,1385.7599,"karşısına geçip ona derin bir şekilde boyun eğdi. Tüm bunlar, Hindenberg'i yanına çekerek, Anayasa'nın elli üçüncü maddesinin Cumhurbaşkanına verdiği meclisi dağıtma yetkisini kullanmayacağını garanti altına almak için, Hitler ve Propaganda Bakanı olacak olan Goebbels tarafından kore koreografilenmiş adımlardı ve bu jestler hemen meyvesini verdi. Aynı gün geçirilen bir yasayla, cinayet de dahil her türlü suçtan hapis yatan Nazilerin affedilmesine karar verildi. Yani vatana ihanetten hüküm giymiş kişiler bile, birdenbire ulusal kahramana dönüştüler.",0,31.7548000000006,b4z2WdDozU0
37,1386.0599,1418.84,"Bakın aynı gün, Berlin'in hemen kuzeyindeki Oraniyenburg şehir merkezinde ilk toplama kampı kuruldu. Ondan hemen bir gün sonra Bavaria'nın Dachao kentinde toplanan ilk Yahudiler bu kamplara getirilmeye başlandı. Değişimin hızını görebiliyor musunuz? İşte Hitler'in demokrasiyi mat edeceği gün olan yirmi üç Mart bin dokuz yüz otuz üç günü böyle geldi. Hükümet, o gün Hitler'e kayıtsız şartsız tüm yetkileri verecek olan yetki kanununu görüşmek üzere, yanlış meclis binasının hemen karşısındaki",0,30.5601999999999,b4z2WdDozU0
38,1419.2999,1454.995,"Crowl Opera binasında toplandı. Bu kanun güçler ayrılığını tamamen ortadan kaldırmayı öneriyordu. Buna göre Reich hükümeti, parlamentodan bağımsız olarak yasa yapabilecekti. Hatta o yasalar parlamentoya ve Cumhurbaşkanına karşı olmadığı müddetçe, anayasal olmak zorunda da olmayacaktı. Sadece devletin resmi gazetesinde yayınlanması yeterli olacaktı ve ertesi gün devreye girecekti. Yabancı ülkelerle yapılacak anlaşmalar, parlamento onayı olmaksızın imzalanabilecekti. Bütün denge ve kontrol mekanizmaları ortadan kaldırılacak, demokrasi yıkılacak,",0,30.7548999999995,b4z2WdDozU0
39,1455.375,1492.16,"Hitler liderliğindeki tam totaliteryen bir yönetime geçilecekti. Bunun karşılığında Hitler'den beklenen Alman ekonomisini düzeltmesi, Almanya'yı tekrardan ayağa kaldırması, işsizlik sorununu çözmesi ve hükümete stabilite getirmesiydi. Ha bir de, bir Nisan bin dokuz yüz otuz yedide bu olağanüstü yetkiler ortadan kalkacak, güya işler normale dönecekti. Evet, bir Nisan'da. Almanlar, sanırım güç zehirlenmesi nedir, hiç duymamıştı. Böylesi bir gücü tadanın onu bırakması mümkün mü sanıyorsunuz? Neyse, o bir başka videonun konusu. Tahmin edebileceğiniz gibi yirmi üç Mart'taki",0,32.7648999999999,b4z2WdDozU0
40,1493.02,1528.0701,"görüşmeler çok sert geçti. İlk etapta Hitler'in yükselişinden korkarak İsviçre ve diğer komşu ülkelere kaçan, Sosyal Demokrat Otto Wells gibi bazı politikacılar tutuklanma ve hatta öldürülme riskine rağmen opera binasına gelip Hitler'in karşısına çıkma cüretini gösterdiler. Hitler onlara bakarak, ulusumuza ve insanlarımıza yapılan ihanet gelecekte acımasız bir barbarlıkla damgalanacaktır diyerek onlara tehditler savurdu. Wells ise kendi konuşması sırasında Hitler'e döverek, hiçbir yasa size insani ve hukuki prensipler,",0,32.6898000000001,b4z2WdDozU0
