id,start,end,page_content,speaker,duration,video_id
41,1528.6901,1566.1951,"özgürlük ve sosyalizm gibi sonsuz ve yıkılamaz fikirleri yok etme gücünü veremez dedi. Hitler bir ara ayağa kalkacak gibi oldu ama yanında oturan eski otokratik Şansölye France von Papen, onu yerinde tuttu. Asıl hedefi unutma der gibiydi. Bu demokrasi zorla güçle değil, demokrasiyle yıkılacak. Hitler, sıra tekrar kendisine geldiğinde, çok kritik bir retoriyi takip etti. Sosyal Demokratlara dönerek, on üç yıldır baştaydınız. Yani Almanlar için gerçekten önemli olan meseleleri. İşsizliği, istikrarsızlığı, onursuzluğu çözmek için tam on üç yılınız vardı. Niye çözmediniz",0,34.0797,b4z2WdDozU0
42,1566.4951,1604.4099,"diye sordu. Bu sözler Meclis'te alkışlarla karşılandı. İşte bu karşılıklı atışmalar bir süre daha devam etti ama artık gidişat belliydi. Taşlar yerine oturuyordu. Hitler rakiplerini gırtlaklarından yakalamış ve duvara mıhlamıştı. Konuşmalar bittiğinde, parlamento oylamaya geçti. Oylama, akşam sekizden biraz önce tamamlandı. Sosyal demokratların doksan dört delegesi birden hayır oyu verdi. Parlamentonun geri kalan dört yüz kırk dört üyesinin tamamıysa evet oyu vererek, yüzde seksenlik dev bir çoğunluğa eriştiler. Bu, hiçbir düzeltme veya ek tartışma",0,33.8495999999998,b4z2WdDozU0
43,1604.7899,1654.465,"olmaksızın yasanın geçmesi demekti. Anlayacağınız Hitler, şansölyelik unvanına erişmesinden tam bir ay, üç hafta, iki gün, sekiz saat ve kırk dakika sonra, demokrasiyi yerle bir etmeyi başardı. Sonrası bildiğiniz tarih. İşte böyle. Bu bence üzerinde uzun uzun düşünülmesi gereken olağanüstü bir hikaye. Tabii ki dünya savaşları ve bu savaşlara giden yolda yaşananların her parçası hayret uyandırıcı. Ama etrafımızda olan biten şeylerin sebeplerine ve mekanizmalarına müthiş ilgi duyan biri olarak, benim de Alman tarihinde dikkatimi en çok çeken şey, Adolf Hitler gibi bir karakterin tarih sahnesine nasıl çıktığı ve şaşırtıcı düzeyde kısa bir sürede demokrasi gibi bir sisteme nasıl diz çöktürebildiğiydi.",0,44.3400999999997,b4z2WdDozU0
44,1655.005,1688.5049,"Geçtiğimiz günlerde tarihçi Timothy Reieback'in The Atlantic için tam da bu konuda yazdığı bir yazıyı okurken, bu süreci size video olarak anlatmanın çok etkili ve öğretici olacağını düşündüm. Bu videoyu da o nedenle çektim. Demokrasinin sınırlarının tekrardan test edildiği yirmi birinci yüzyılda bu hikayeden çıkarılacak çok ders olduğunu düşünüyorum veya benim ne düşündüğümü boş verin. O son oylamanın yapıldığı gün de orada bulunan ve Hitler'in en sadık yaverlerinden olan meşhur propagandist Joseph Goebbels'in sözlerini hatırlayın. Demokrasinin en komik tarafı,",0,32.2196999999996,b4z2WdDozU0
45,1688.8099,1697.63,"en ölümcül düşmanlarına bile kendisini öldürmelerini sağlayacak silahlar veriyor olması. Bir sonraki videoda görüşmek üzere, hoşça kalın.",0,8.14010000000007,b4z2WdDozU0
